,Post ID,Text,Likes,Comments,Shares
0,3959542910789906,"Yalnız onlayn sifarişlərdə Gündəlik Tələbat Krediti daha sərfəli!
Çünki onlayn müraciətlərdə illik faiz dərəcəsi 17%-dən başlayır. Üstəlik, nağdlaşdırma komissiyası da yoxdur.

Kampaniya 30 iyunadək keçərlidir.

İndi müraciət et: kbl.az/cl17fb

Daily Demand Credit is more profitable on online orders only!
Because the annual interest rate in online applications starts at 17 %- Plus, there is no cash commission either.

The campaign is valid until June 30

Apply now at: kbl.az/cl17fb",82,434,6
1,4003674316376765,"“Agile söhbətləri” layihəsinin dördüncü canlı yayımı 9 iyun tarixində saat 16:00-da baş tutacaq!
Bankımızın peşəkar əməkdaşları “Agile - Yeniliklərə açıq ol!” mövzusu üzrə danışacaqlar.

#BirinciBank #Agile

The fourth live broadcast of the ′′ Agile Talks ′′ project will take place on June 9 at 16:00!
Professional employees of our bank will talk about ′′ Agile - Be open to innovations!""

#BirinciBank #Agile",77,12,11
2,4003003376443859,"Müştəri Bank ilə biznes hesabınızı rahatlıqla yaradın!

Bankımızın korporativ müştərilərimiz üçün təqdim etdiyi Müştəri Bank ilə biznes hesabınızı artıq bankımızın filiallarına yaxınlaşmadan tam onlayn şəkildə açmaq mümkündür.

Müştəri Banka qoşulmaq üçün: ▶️ https://onb-cb.kapitalbank.az/

Create your business account easily with Customer Bank!

It is possible to open your business account completely online without approaching the branches of our bank with Customer Bank presented by our bank for our corporate customers.

Customer to join the Bank: ▶️ https://onb-cb.kapitalbank.az/",35,19,6
3,3992699650807565,"Artıq yalnız şəxsiyyət vəsiqənizin FİN-kodunu daxil edərək onlayn qaydada BirKart və ya nağd kredit üçün müraciət edə bilərsiniz.

Now you can apply for BirCard or cash loan online only by entering the FIN-code of your ID card.",66,74,24
4,3981047731972757,"Müştəri Bank ilə maliyyə əməliyyatlarınızı bir platformadan idarə edin!

Bankımızın korporativ müştərilərimiz üçün təqdim etdiyi Müştəri Bank platforması ilə hesablarınıza nəzarət edə, köçürmələr və ödənişlər apara, həmçinin digər bank əməliyyatlarını çevik şəkildə həyata keçirə bilərsiniz.

Müştəri Banka qoşulmaq üçün: ▶️ https://onb-cb.kapitalbank.az/

Manage your financial transactions from one platform with Customer Bank!

You can monitor your accounts, carry out transfers and payments with the Customer Bank platform presented by our bank for our corporate customers, as well as flexible as other bank transactions.

Customer to join the Bank: ▶️ https://onb-cb.kapitalbank.az/",64,29,13
